EIN,OrgID,OverallRtg,Tax_Year,Charity Name,Category,Cause,Focus,Total_Assets,Total_Liabilities,Total_Net_Assets,Wkg_Capital,Total_Contributions,ProgSvcRev,Other_Revenue,Total_Revenue,Fundraising_Expenses,Administration_Expenses,Program_Expenses,Total_Expenses,
310805578,6892,3,2015,Ohio Environmental Council,Environment,Environmental Protection and Conservation,Law & Policy,744427,362859,381568,381568,1647339,26549,32917,1706805,163827,140201,1351080,1655108,FALSE
731435473,9063,3,2015,Oklahoma Baptist Homes for Children,Human Services,"Youth Development, Shelter, and Crisis Services","Homes, Shelters, & Crisis Services",84942862,2718734,82224128,28894985,9156470,0,4100135,13256605,2151609,2171633,9018127,13341369,FALSE
042104805,7528,4,2015,Old Dartmouth Historical Society/New Bedford Whaling Museum,"Arts, Culture, Humanities","Libraries, Historical Societies and Landmark Preservation",Historical Societies,32483333,2538653,29944680,25984174,3356096,666293,443930,4466319,373264,385263,3273886,4032413,FALSE
576027750,10501,3,2016,Oliver Gospel Mission,Human Services,Homeless Services,Rescue Missions,14651991,549405,14102586,13991299,4234777,228808,151874,4615459,454333,323633,1925243,2703209,FALSE
133248876,17120,4,2015,Oliver Scholars,Education,Youth Education Programs and Services,After-school Educational Programs & Services for Elementary and Secondary Students,3608566,46528,3562038,3562038,1610250,10848,-447064,1174034,226885,130443,1496883,1854211,FALSE
043290689,8600,3,2015,On The Rise,Human Services,Homeless Services,Homelessness - Direct Services,2557129,30184,2526945,2526945,1179429,0,32812,1212241,177092,138568,781535,1097195,FALSE
203668110,13262,4,2015,One Acre Fund,International,Development and Relief Services,Economic and Agricultural Development,50806937,16804919,34002018,34002018,39502726,29636039,1759392,70898157,1654397,2397642,55798747,59850786,FALSE
200443243,16363,4,2015,One Heart World-Wide,International,Development and Relief Services,Humanitarian Services,2464913,19572,2445341,2445341,4472258,0,0,4472258,69912,91774,3004940,3166626,FALSE
421710230,14192,3,2016,One Million Degrees,Education,Youth Education Programs and Services,Educational Programs & Services for Postsecondary Students,2008372,300246,1708126,1708126,3021708,0,-153291,2868417,335081,330009,1345989,2011079,FALSE
953900124,16003,3,2015,One Voice,Human Services,Social Services,Other,2694030,9005,2685025,2685025,1414410,0,125088,1539498,126384,82956,1301437,1510777,FALSE
770479205,16918,3,2015,One World Children's Fund,International,Development and Relief Services,Economic and Agricultural Development,622388,16644,605744,605744,1496529,0,-2215,1494314,65311,102963,1377839,1546113,FALSE
954714047,7612,3,2015,OneSky (Half the Sky Foundation),International,Development and Relief Services,Child Sponsorship,3433803,558083,2875720,2875720,6619121,0,-2912,6616209,387914,463588,5770795,6622297,FALSE
204830666,16378,3,2016,Open Books,Education,Youth Education Programs and Services,Literacy Programs,455210,195415,259795,259795,1327576,51302,439534,1818412,133389,138886,1641276,1913551,FALSE
580601980,13158,4,2016,Open Door Community House,Human Services,Children's and Family Services,Family Care & Development,3124624,57258,3067366,2867366,1305302,1395,131990,1438687,96044,62130,1373059,1531233,FALSE
760146890,7620,3,2015,"Open Door Mission, Houston",Human Services,Homeless Services,Rescue Missions,3641114,76788,3564326,3564326,3008857,38093,-57915,2989035,734301,247369,2377785,3359455,FALSE
237088427,14683,4,2015,Open Doors Kalamazoo,Human Services,Homeless Services,Homelessness - Direct Services,2680216,67989,2612227,2612227,645123,351354,21627,1018104,64820,143345,854933,1063098,FALSE
581816778,8228,3,2015,Open Hand,Human Services,Social Services,Food Services,6589760,1779492,4810268,4810268,7271376,3104778,42995,10419149,744582,386748,9813948,10945278,FALSE
363488089,8208,4,2015,Open Your Heart to the Hungry and Homeless,Human Services,Social Services,Other,787165,16356,770809,770809,865835,0,865,866700,25374,56302,802612,884288,FALSE
943337955,17209,3,2016,Openhouse,Human Services,Social Services,Services for the Elderly,1739115,125082,1614033,1614033,2280842,125241,216911,2622994,328934,109052,1204718,1642704,FALSE
943180356,12074,4,2015,Operation Access,Health,Patient and Family Support,Patient & Family Support,1482865,85734,1397131,1397131,1231465,107084,11515,1350064,135195,90149,1093749,1319093,FALSE
541382657,4265,3,2016,Operation Blessing International,International,Humanitarian Relief Supplies,Medical Supplies,43343133,36953373,6389760,6389760,307382795,0,231824,307614619,2345640,1097564,304780777,308223981,FALSE
430971560,12275,4,2016,Operation Breakthrough,Human Services,Children's and Family Services,Child Care and Development,17103462,665190,16438272,16438272,6441522,739514,1375556,8556592,591145,1241947,6451552,8284644,FALSE
208964096,17545,3,2016,Operation Finally Home,Human Services,Social Services,"Veterans, Military, and Families",4327560,1361948,2965612,2965612,5055765,0,324535,5380300,1162610,608594,4762930,6534134,FALSE
201622436,16637,4,2015,Operation First Response,Human Services,Social Services,"Veterans, Military, and Families",347745,1161,346584,346584,862979,0,181,863160,13068,23646,1009324,1046038,FALSE
431241854,4266,3,2016,Operation Food Search,Human Services,"Food Banks, Food Pantries, and Food Distribution","Food Banks, Food Pantries, and Food Distribution",8392317,1106030,7286287,7286287,34818640,37654,388327,35244621,448057,203524,31007375,31658956,FALSE
200103575,14184,4,2015,Operation Gratitude,Human Services,Social Services,"Veterans, Military, and Families",7350820,22344,7328476,7328476,8084694,0,6468,8091162,259131,234094,7828733,8321958,FALSE
320033325,10849,4,2015,Operation Homefront,Human Services,Social Services,"Veterans, Military, and Families",53520927,2365600,51155327,51155327,49853391,0,598767,50452158,2009112,2249705,48574690,52833507,FALSE
954378084,10136,4,2015,Operation HOPE,Human and Civil Rights,Advocacy and Education,"Advocates for Tolerance, Civil Rights, & Civil Liberties",11242076,3424970,7817106,7817106,13982635,0,80015,14062650,552039,1724978,11548736,13825753,FALSE
751553350,5693,4,2015,Operation Kindness,Animals,"Animal Rights, Welfare, and Services",No-Kill Shelters,6485555,134470,6351085,6351085,2825458,741216,587175,4153849,627101,462162,2694945,3784208,FALSE
202624345,16901,4,2016,Operation Second Chance,Human Services,Social Services,"Veterans, Military, and Families",1668569,3620,1664949,1664949,1184252,0,7887,1192139,24477,96134,970742,1091353,FALSE
204275756,13252,4,2015,Operation Support Our Troops - America,Human Services,Social Services,"Veterans, Military, and Families",1226364,15236,1211128,1211128,1491326,0,17144,1508470,90476,86743,1096105,1273324,FALSE
311719434,12857,4,2016,Opportunity Fund Community Development ,Community Development,Housing and Neighborhood Development,Business Instruction and Credit Services,75398341,49782874,25615467,25615467,8470382,9883104,-62066,18291420,964777,1600237,11519222,14084236,FALSE
540907624,4270,3,2015,Opportunity International,International,Development and Relief Services,Economic and Agricultural Development,37449255,16822314,20626941,15619316,21378858,84088381,2332999,107800238,7839436,3256182,120761522,131857140,FALSE
590624429,13922,4,2016,"Opportunity, Inc. of Palm Beach County",Education,Early Childhood Programs and Services,Early Education & Preschool,7315073,122746,7192327,6692327,3255629,621724,-44679,3832674,75721,263687,1336692,1676100,FALSE
330047994,4649,3,2016,Orange County United Way,Community Development,United Ways,United Ways,27501133,6805722,20695411,16057858,18245147,0,557228,18802375,2064717,1478621,15278238,18821576,FALSE
953616628,13120,3,2016,Orangewood Foundation,Human Services,Children's and Family Services,Child Care and Development,47929011,21613215,26315796,24337367,9228896,87627,144894,9461417,575744,716662,6724011,8016417,FALSE
237297651,4368,4,2015,ORBIS International,International,Development and Relief Services,Large International Relief and Development NGOs,55409503,2343660,53065843,53065843,162444210,0,2421527,164865737,6686214,5873581,152138250,164698045,FALSE
931009305,7417,3,2016,Oregon Ballet Theatre,"Arts, Culture, Humanities",Performing Arts,Dance,5092569,1170338,3922231,3863808,1977517,3797842,4416381,10191740,334374,521781,5479813,6335968,FALSE
931029893,8314,4,2016,Oregon Energy Fund,Human Services,Social Services,Utility Assistance,1595042,17043,1577999,1577999,1095010,0,28309,1123319,149634,47183,1014293,1211110,FALSE
930578714,7414,4,2016,Oregon Environmental Council,Environment,Environmental Protection and Conservation,Law & Policy,2575384,131037,2444347,2015621,2826010,42188,9968,2878166,197992,140911,2494890,2833793,FALSE
930785786,4277,4,2016,Oregon Food Bank,Human Services,"Food Banks, Food Pantries, and Food Distribution","Food Banks, Food Pantries, and Food Distribution",38769189,2635802,36133387,36133387,61042366,3568074,102760,64713200,3112793,1353917,62573096,67039806,FALSE
930386880,4278,4,2016,Oregon Humane Society,Animals,"Animal Rights, Welfare, and Services",Humane Societies/SPCA's,46495314,2387584,44107730,40599850,11554452,2896127,961692,15412271,2106980,1046532,11110746,14264258,FALSE
930718337,5783,3,2016,Oregon Zoo Foundation,Animals,Zoos and Aquariums,Zoological Societies,13965339,1827081,12138258,12056445,6397466,0,198474,6595940,1023511,485629,3904354,5413494,FALSE
770252545,10779,3,2015,Organic Farming Research Foundation,Research and Public Policy,Social and Public Policy Research,Social & Public Policy Research,725944,39506,686438,580710,618725,0,1511,620236,64970,111418,535900,712288,FALSE
590910352,14285,3,2016,Orlando Museum of Art,"Arts, Culture, Humanities",Museums,Art,16629507,279942,16349565,9578619,1683938,571515,599024,2854477,306078,667045,2300204,3273327,FALSE
593058884,13605,3,2016,Orlando Philharmonic Orchestra,"Arts, Culture, Humanities",Performing Arts,Symphonies & Orchestras,4565502,586289,3979213,2237662,1572007,2013845,340984,3926836,343674,234701,6036008,6614383,FALSE
590896343,9614,3,2016,Orlando Science Center,"Arts, Culture, Humanities",Museums,Science & Technology,14893673,3097652,11796021,10856026,4654571,6020893,1067892,11743356,382485,623354,9060462,10066301,FALSE
591035082,9253,3,2015,Orlando Union Rescue Mission,Human Services,Homeless Services,Rescue Missions,7923101,266484,7656617,7656617,5106161,69877,47759,5223797,837412,339441,4348792,5525645,FALSE
541995429,11392,2,2016,Orphan Helpers,Religion,Religious Activities,Christian - International,138283,31014,107269,107269,541561,20199,98127,659887,118141,49055,476901,644097,FALSE
810530827,10946,3,2015,Orphan's Lifeline of Hope International,International,Development and Relief Services,Child Sponsorship,585538,0,585538,585538,1825720,0,68817,1894537,13193,223610,1358773,1595576,FALSE
391709813,8416,2,2016,Oshkosh Area Humane Society,Animals,"Animal Rights, Welfare, and Services",Humane Societies/SPCA's,3351939,358735,2993204,1744249,444273,69079,249627,762979,41494,147364,737001,925859,FALSE
431213751,10429,4,2015,Our Lady's Inn,Human Services,Children's and Family Services,Family Care & Development,3590560,96273,3494287,3179784,2129616,0,121556,2251172,225989,177044,1949125,2352158,FALSE
431567500,15336,4,2016,Our Little Haven,Human Services,"Youth Development, Shelter, and Crisis Services","Homes, Shelters, & Crisis Services",10802592,1542239,9260353,9260353,2794389,0,253993,3048382,221379,143602,2450695,2815676,FALSE
060939659,12711,4,2016,Our Piece of the Pie,Human Services,"Youth Development, Shelter, and Crisis Services","Clubs, Centers, & Development Programs",7868739,5560786,2307953,2307953,7015398,377640,55425,7448463,244969,435322,6411765,7092056,FALSE
020681855,14208,3,2015,Out & Equal Workplace Advocates,Human and Civil Rights,Advocacy and Education,"Advocates for Gay, Lesbian, and Transgender Rights",2770474,485649,2284825,2284825,3681633,2165088,-110194,5736527,418040,670916,4051438,5140394,FALSE
382461102,17037,3,2015,Outdoor Discovery Center Macatawa Greenway,Environment,"Botanical Gardens, Parks, and Nature Centers","Outdoor Programs, Parks, & Nature Centers",9815079,1398339,8416740,8416740,2411376,230585,67220,2709181,141965,149593,2128783,2420341,FALSE
431164177,5350,4,2016,Outreach International,International,Development and Relief Services,Economic and Agricultural Development,4096933,318621,3778312,3470909,4084892,0,4657,4089549,241802,222350,2535636,2999788,FALSE
133806788,8037,4,2015,Ovarian Cancer Research Fund Alliance,Health,Medical Research,General & Other Research,29913445,10776634,19136811,19136811,6531736,0,606553,7138289,754946,728332,6861939,8345217,FALSE
510194054,6204,3,2016,Overlook Foundation,Health,Treatment and Prevention Services,Hospital Foundations,78959503,7427904,71531599,41928304,6505448,0,2350512,8855960,1947207,477802,3783505,6208514,FALSE
237069110,4288,3,2017,Oxfam America,International,Development and Relief Services,Large International Relief and Development NGOs,81998618,17270849,64727769,62931209,77603597,0,1569040,79172637,13388395,6651085,66376285,86415765,FALSE
431426384,7044,4,2015,Ozarks Food Harvest,Human Services,"Food Banks, Food Pantries, and Food Distribution","Food Banks, Food Pantries, and Food Distribution",11991399,168043,11823356,11823356,27545891,874501,43847,28464239,562673,554070,26915421,28032164,FALSE
953931147,15433,4,2016,P.S. ARTS,Education,Youth Education Programs and Services,Arts Education,3744838,220426,3524412,1470842,2569487,1200452,-47818,3722121,299129,231187,2793649,3323965,FALSE
330051202,11449,3,2015,Pacific Crest Trail Association,Environment,Environmental Protection and Conservation,Multipurpose Environmental Programs,2498038,149930,2348108,1296966,1804705,912880,48683,2766268,579781,268874,1676956,2525611,FALSE
942628924,10509,3,2016,Pacific Environment,Environment,Environmental Protection and Conservation,Multipurpose Environmental Programs,1705847,207216,1498631,1498631,1424958,3019,1517,1429494,118330,115840,1099409,1333579,FALSE
061144355,9132,4,2016,Pacific House,Human Services,Homeless Services,Homelessness - Direct Services,10162312,6336297,3826015,3826015,2340528,303905,629101,3273534,194389,288150,2391207,2873746,FALSE
520812075,4348,4,2015,PAI,Human and Civil Rights,Advocacy and Education,Advocates for Abortion & Reproductive Rights,8901173,1008601,7892572,7735904,4979950,756404,43995,5780349,406131,1028489,5876720,7311340,FALSE
951809576,7466,3,2015,Palm Springs Art Museum,"Arts, Culture, Humanities",Museums,Multipurpose Museums,40337715,2267229,38070486,13434533,7453983,1309679,1794650,10558312,1909640,1590544,8396267,11896451,FALSE
770186364,11731,4,2016,Palo Alto Partners in Education,Education,Scholarship and Financial Support,Education & School Foundations,623664,1000,622664,622664,6137420,0,9360,6146780,228144,76773,5844960,6149877,FALSE
591580961,10930,2,2016,Panama City Rescue Mission,Human Services,Homeless Services,Rescue Missions,1048744,403015,645729,645729,1520664,176443,-156116,1540991,557317,112205,974969,1644491,FALSE
330841281,7608,4,2016,Pancreatic Cancer Action Network,Health,"Diseases, Disorders, and Disciplines",Cancer,35185365,13944982,21240383,21240383,34319563,5940,-1666805,32658698,3283670,3376687,26089959,32750316,FALSE
481093130,13828,3,2015,Pando Initiative,Education,Youth Education Programs and Services,In-School Educational Programs & Services for Elementary and Secondary Students,501651,169927,331724,331724,953915,388025,15718,1357658,107427,109785,1109789,1327001,FALSE
131946868,4295,2,2016,Paralyzed Veterans of America,Human and Civil Rights,Advocacy and Education,Veterans Services & Advocacy,64441756,11045923,53395833,53395833,100829097,602290,5400307,106831694,36814746,4912447,65133718,106860911,FALSE
391393216,10619,4,2016,Paralyzed Veterans of America Wisconsin Chapter,Human and Civil Rights,Advocacy and Education,Veterans Services & Advocacy,766870,19529,747341,747341,333370,8343,35163,376876,29701,23836,361460,414997,FALSE
930706557,11628,2,2016,Parenting Now!,Human Services,Children's and Family Services,Child Care and Development,1016919,503784,513135,513135,499676,505828,41227,1046731,115498,157726,849883,1123107,FALSE
581883895,8685,4,2015,Park Pride,Environment,"Botanical Gardens, Parks, and Nature Centers",Urban Parks,3857991,835039,3022952,3022952,3510684,330306,13627,3854617,81593,181048,2806740,3069381,FALSE
200205035,11836,1,2015,Parkinson Research Foundation,Health,"Diseases, Disorders, and Disciplines",Parkinson's Disease,886524,28390,858134,858134,1526581,0,0,1526581,385184,247760,985493,1618437,FALSE
043567502,4884,4,2016,Partners In Health,International,Development and Relief Services,Humanitarian Services,77882363,11243582,66638781,61804017,107681982,89968,1295243,109067193,4198916,9498340,131525227,145222483,FALSE
473730147,6293,2,2015,Partnership With Native Americans,Human Services,Social Services,Native American Social Services and Development,23183517,1314636,21868881,21803016,24979589,0,347808,25327397,5580188,1050151,18878704,25509043,FALSE
953900207,16004,4,2016,Pasadena Conservatory of Music,"Arts, Culture, Humanities",Performing Arts,Artist Support & Development,10251945,432446,9819499,9765453,907787,2061877,-15967,2953697,182802,402107,2405752,2990661,FALSE
911843707,6634,4,2016,Pasado's Safe Haven,Animals,"Animal Rights, Welfare, and Services",Humane Societies/SPCA's,4368752,198752,4170000,4170000,1902149,142846,101044,2146039,256074,219647,2154239,2629960,FALSE
911157127,17560,4,2015,PATH,International,Development and Relief Services,Large International Relief and Development NGOs,620397961,48893160,571504801,568115191,277752285,24796,5170980,282948061,3575067,46819702,238707389,289102158,FALSE
541806317,12466,4,2016,Patient Advocate Foundation,Health,Patient and Family Support,Patient & Family Support,182470919,12276922,170193997,168707755,156959512,3302498,712057,160974067,1169671,1194927,66863193,69227791,FALSE
541596178,7168,4,2015,Patient Services Incorporated,Health,Patient and Family Support,Patient & Family Support,121450372,1138828,120311544,120311544,128034479,0,318237,128352716,1214675,3978599,102052310,107245584,FALSE
391590212,5320,3,2016,PAVE,Education,Scholarship and Financial Support,Scholarships & Financial Aid,12749010,156961,12592049,12592049,842413,80246,223210,1145869,91072,399091,1093642,1583805,FALSE
916073154,5775,4,2015,PAWS (Progressive Animal Welfare Society),Animals,"Animal Rights, Welfare, and Services",Humane Societies/SPCA's,12473639,283513,12190126,10921256,4931894,692136,-63050,5560980,754257,237639,2978797,3970693,FALSE
364219778,6151,4,2015,PAWS Chicago,Animals,"Animal Rights, Welfare, and Services",No-Kill Shelters,40843199,781556,40061643,36895347,14959514,2074119,354685,17388318,526584,761440,10446993,11735017,FALSE
382370342,4307,4,2016,Paws With A Cause,Animals,"Animal Rights, Welfare, and Services",Training & Specialty Services,6200945,109184,6091761,5313401,3693496,0,212686,3906182,300473,404240,3169723,3874436,FALSE
133280193,4978,4,2015,PCI Media Impact,International,"International Peace, Security, and Affairs",Human Rights,1606949,201842,1405107,1405107,5125958,0,46504,5172462,147087,432846,4379152,4959085,FALSE
042738794,4880,4,2016,Peace Development Fund,International,"International Peace, Security, and Affairs",International Peace and Security,1292901,30000,1262901,1262901,2954952,143051,12751,3110754,75988,81198,2548065,2705251,FALSE
770562800,10710,2,2016,Peaceful Valley Donkey Rescue,Animals,Wildlife Conservation,Sanctuaries,1621904,357146,1264758,1264758,2877881,0,-1910,2875971,643196,247136,1769691,2660023,FALSE
522272092,11444,3,2015,PeacePlayers International,Human Services,Multipurpose Human Service Organizations,Athletics Organizations,1182121,170346,1011775,1011775,2787327,141477,-68490,2860314,289132,231806,2269908,2790846,FALSE
231637212,8089,3,2016,Pearl S. Buck International,International,Development and Relief Services,Child Sponsorship,3317982,756901,2561081,2484781,1881439,155376,103249,2140064,224227,103857,1737239,2065323,FALSE
581966822,8067,3,2015,Pediatric Brain Tumor Foundation,Health,Medical Research,General & Other Research,2897967,1320681,1577286,1577286,5417837,0,109531,5527368,574928,783385,5315499,6673812,FALSE
953772528,6469,4,2015,Pediatric Cancer Research Foundation,Health,Medical Research,Cancer,1980911,541716,1439195,1439195,2947588,313115,-572869,2687834,308976,140469,1687433,2136878,FALSE
060932894,15615,1,2016,Pegasus Therapeutic Riding,Health,Patient and Family Support,Patient & Family Support,5318891,5216,5313675,5203675,2377842,64453,-3766,2438529,303740,200383,776382,1280505,FALSE
133447888,11411,4,2015,PEN American Center,"Arts, Culture, Humanities",Performing Arts,Artist Support & Development,5091445,325966,4765479,3946999,4348221,116688,85153,4550062,973409,333770,3456730,4763909,FALSE
223384302,11520,2,2016,PENCIL,Education,Adult Education Programs and Services,Professional Development & Vocational Training,2659473,163111,2496362,2496362,2752547,0,93521,2846068,690763,349659,2086464,3126886,FALSE
943227262,5835,4,2015,Peninsula Jewish Community Center,Human Services,Multipurpose Human Service Organizations,"Y M C A's, Y W C A's & JCC's",33770797,10260717,23510080,17490046,1361592,15037035,1693010,18091637,209049,450127,15796799,16455975,FALSE
237286159,5144,3,2016,Pennsylvania Environmental Council,Environment,Environmental Protection and Conservation,Law & Policy,2534577,555776,1978801,1966746,2409665,209772,-115283,2504154,59259,365260,2774785,3199304,FALSE
231352269,7626,4,2015,Pennsylvania SPCA,Animals,"Animal Rights, Welfare, and Services",Humane Societies/SPCA's,26910570,1335978,25574592,13241125,5880012,2041040,805835,8726887,980069,692229,7366067,9038365,FALSE
363157600,7943,4,2016,People's Resource Center,Human Services,Social Services,Other,6733778,597421,6136357,6136357,8904571,0,349381,9253952,279201,414554,8390561,9084316,FALSE
043252955,12043,4,2016,Per Scholas,Human Services,Social Services,Employment,7356287,1751928,5604359,5604359,9493541,0,1107032,10600573,601494,1325947,8261738,10189179,FALSE
810393444,10623,4,2016,PERC,Environment,Environmental Protection and Conservation,Law & Policy,4912264,44718,4867546,4754800,2450572,0,33372,2483944,247977,326411,1695201,2269589,FALSE
042103616,8856,3,2015,Perkins School for the Blind,Education,Special Education,Special Education,375859144,37676382,338182762,263916001,13352398,36868651,5488597,55709646,3677210,9642680,52530153,65850043,FALSE
061422248,10597,4,2015,Person-to-Person,Human Services,Social Services,Other,5502941,87816,5415125,5415125,12010860,0,319149,12330009,505624,272555,11570375,12348554,FALSE
590637883,5557,4,2016,Pet Alliance of Greater Orlando,Animals,"Animal Rights, Welfare, and Services",Humane Societies/SPCA's,6042914,450478,5592436,5592436,1449721,4526741,-10089,5966373,234501,163926,6361876,6760303,FALSE
911158281,5765,3,2015,Pet Partners,Health,Patient and Family Support,Patient & Family Support,7891843,365083,7526760,6464336,1111102,438553,140812,1690467,519285,326935,1348590,2194810,FALSE
841612045,14240,3,2015,PetAid Colorado,Animals,"Animal Rights, Welfare, and Services",Animal Rights and Welfare,2656154,564634,2091520,2091520,1698115,0,142000,1840115,379182,262303,1257712,1899197,FALSE
133412917,16350,3,2015,Peter Westbrook Foundation,Human Services,"Youth Development, Shelter, and Crisis Services","Clubs, Centers, & Development Programs",10284896,26596,10258300,3422405,1626731,15200,310392,1952323,77537,99836,427709,605082,FALSE
870694641,13219,4,2016,Petfinder Foundation,Animals,"Animal Rights, Welfare, and Services",Animal Rights and Welfare,1969234,1387,1967847,1967847,1275207,0,18087,1293294,79661,31756,1194842,1306259,FALSE
232210390,10406,4,2015,Philadelphia Volunteers for the Indigent Program,Human and Civil Rights,Advocacy and Education,Legal Services,1230034,2293,1227741,1227741,1053632,0,359,1053991,112688,137886,864958,1115532,FALSE
866057771,5754,3,2016,Phoenix Rescue Mission,Human Services,Homeless Services,Rescue Missions,20447543,4743478,15704065,15704065,13168853,391231,22563,13582647,3015123,597893,8879595,12492611,FALSE
222488437,5058,4,2016,Physicians for Human Rights,International,"International Peace, Security, and Affairs",Human Rights,7888616,2005357,5883259,5883259,7666821,0,-46821,7620000,608368,337262,6103377,7049007,FALSE
840511799,9866,3,2016,Pikes Peak United Way,Community Development,United Ways,United Ways,7003462,2643467,4359995,2981138,6293937,142481,86801,6523219,619789,785887,4345528,5751204,FALSE
521935342,17049,2,2015,Pinchot Institute for Conservation,Environment,Environmental Protection and Conservation,Forests,1107700,347412,760288,760288,1379213,193358,102878,1675449,23743,499013,1290073,1812829,FALSE
650841384,12206,4,2015,Place of Hope,Human Services,"Youth Development, Shelter, and Crisis Services","Homes, Shelters, & Crisis Services",13453414,647497,12805917,12805917,6206096,0,406281,6612377,458153,307161,4620080,5385394,FALSE
942607682,6547,4,2015,Placer SPCA,Animals,"Animal Rights, Welfare, and Services",Humane Societies/SPCA's,8982260,325146,8657114,8657114,1998544,1026917,417723,3443184,294415,185425,1812573,2292413,FALSE
135661832,4337,3,2016,Plan International USA,International,Development and Relief Services,Child Sponsorship,35217363,7053046,28164317,18579683,56865516,0,515189,57380705,4254444,9753027,44624499,58631970,FALSE
952319356,7475,3,2016,Planned Parenthood California Central Coast,Health,Treatment and Prevention Services,Reproductive Health Services,26269338,3557332,22712006,18651978,2911658,11904376,250928,15066962,569715,2520165,12457536,15547416,FALSE
